{
  "$schema": "v5.0.1-change-ledger.schema.json",
  "schemaVersion": 1,
  "fromVersion": "5.0.0",
  "toVersion": "5.0.1",
  "openCvVersion": "5.0.0",
  "nativeAbiVersion": 1,
  "policy": "Only additive-safe, conditional-preview, behavior-fix, documentation, and test/evidence changes are permitted; no existing public/native/package identity is removed or repurposed.",
  "entries": [
    { "id": "MAP-005-CUDAOBJDETECT", "category": "test-evidence", "surface": "tests", "owner": "cudaobjdetect-contrib", "tfms": [ "net10.0" ], "profiles": [ "parser-backed-optional-module" ], "rollback": "remove the scoped CudaObjDetect declaration map and catalog registration while leaving the existing package API and native ABI unchanged", "evidence": [ "tools/XImgProcUpstreamMap/extract_ximgproc.py", "tools/CudaObjDetectUpstreamMap/CudaObjDetectUpstreamMap.csproj", "tools/CudaObjDetectUpstreamMap/Program.cs", "tools/CudaObjDetectUpstreamMap/extract_cudaobjdetect.py", "scripts/Generate-ContribUpstreamMap.ps1", "scripts/Generate-CudaObjDetectUpstreamMap.ps1", "scripts/Test-CudaObjDetectUpstreamMap.ps1", "compatibility/cudaobjdetect-upstream-raw.json", "compatibility/cudaobjdetect-upstream-classifications.json", "compatibility/cudaobjdetect-upstream-map.txt", "compatibility/cudaobjdetect-upstream-summary.json", "compatibility/cudaobjdetect-implemented-families.json", "compatibility/upstream-map-catalog.json", "compatibility/upstream-map-catalog.schema.json", "scripts/New-UpstreamMapCatalog.ps1", "scripts/Test-UpstreamMapCatalog.ps1", "scripts/Initialize-UpstreamMapSourceEvidence.ps1", "docs/articles/upstream-map-toolchain.md", "docs/articles/cudaobjdetect-upstream-parity-guide.md", "docs/toc.yml", "scripts/New-ReleaseCandidateFinalCloseout.ps1", "scripts/Test-ReleaseCandidateFinalCloseout.ps1" ] },
    { "id": "MAP-005-CUDAFEATURES2D", "category": "test-evidence", "surface": "tests", "owner": "cudafeatures2d-contrib", "tfms": [ "net10.0" ], "profiles": [ "parser-backed-optional-module" ], "rollback": "remove the scoped CudaFeatures2D declaration map and catalog registration while leaving the existing package API and native ABI unchanged", "evidence": [ "tools/XImgProcUpstreamMap/extract_ximgproc.py", "tools/CudaFeatures2DUpstreamMap/CudaFeatures2DUpstreamMap.csproj", "tools/CudaFeatures2DUpstreamMap/Program.cs", "tools/CudaFeatures2DUpstreamMap/extract_cudafeatures2d.py", "scripts/Generate-ContribUpstreamMap.ps1", "scripts/Generate-CudaFeatures2DUpstreamMap.ps1", "scripts/Test-CudaFeatures2DUpstreamMap.ps1", "compatibility/cudafeatures2d-upstream-raw.json", "compatibility/cudafeatures2d-upstream-classifications.json", "compatibility/cudafeatures2d-upstream-map.txt", "compatibility/cudafeatures2d-upstream-summary.json", "compatibility/cudafeatures2d-implemented-families.json", "compatibility/upstream-map-catalog.json", "compatibility/upstream-map-catalog.schema.json", "scripts/New-UpstreamMapCatalog.ps1", "scripts/Test-UpstreamMapCatalog.ps1", "scripts/Initialize-UpstreamMapSourceEvidence.ps1", "docs/articles/upstream-map-toolchain.md", "docs/articles/cudafeatures2d-upstream-parity-guide.md", "docs/toc.yml", "scripts/New-ReleaseCandidateFinalCloseout.ps1", "scripts/Test-ReleaseCandidateFinalCloseout.ps1" ] },
    { "id": "MAP-005-CUDACODEC", "category": "test-evidence", "surface": "tests", "owner": "cudacodec-contrib", "tfms": [ "net10.0" ], "profiles": [ "parser-backed-optional-module" ], "rollback": "remove the scoped CudaCodec declaration map and catalog registration while leaving the existing package API and native ABI unchanged", "evidence": [ "tools/XImgProcUpstreamMap/extract_ximgproc.py", "tools/CudaCodecUpstreamMap/CudaCodecUpstreamMap.csproj", "tools/CudaCodecUpstreamMap/Program.cs", "tools/CudaCodecUpstreamMap/extract_cudacodec.py", "scripts/Generate-ContribUpstreamMap.ps1", "scripts/Generate-CudaCodecUpstreamMap.ps1", "scripts/Test-CudaCodecUpstreamMap.ps1", "compatibility/cudacodec-upstream-raw.json", "compatibility/cudacodec-upstream-classifications.json", "compatibility/cudacodec-upstream-map.txt", "compatibility/cudacodec-upstream-summary.json", "compatibility/cudacodec-implemented-families.json", "compatibility/upstream-map-catalog.json", "compatibility/upstream-map-catalog.schema.json", "scripts/New-UpstreamMapCatalog.ps1", "scripts/Test-UpstreamMapCatalog.ps1", "scripts/Initialize-UpstreamMapSourceEvidence.ps1", "docs/articles/upstream-map-toolchain.md", "docs/articles/cudacodec-upstream-parity-guide.md", "scripts/New-ReleaseCandidateFinalCloseout.ps1", "scripts/Test-ReleaseCandidateFinalCloseout.ps1" ] },
    { "id": "MAP-005-CUDAWARPING", "category": "test-evidence", "surface": "tests", "owner": "cudawarping-contrib", "tfms": [ "net10.0" ], "profiles": [ "parser-backed-optional-module" ], "rollback": "remove the scoped CudaWarping declaration map and catalog registration while leaving the existing package API and native ABI unchanged", "evidence": [ "tools/XImgProcUpstreamMap/extract_ximgproc.py", "tools/CudaWarpingUpstreamMap/CudaWarpingUpstreamMap.csproj", "tools/CudaWarpingUpstreamMap/Program.cs", "tools/CudaWarpingUpstreamMap/extract_cudawarping.py", "scripts/Generate-ContribUpstreamMap.ps1", "scripts/Generate-CudaWarpingUpstreamMap.ps1", "scripts/Test-CudaWarpingUpstreamMap.ps1", "compatibility/cudawarping-upstream-raw.json", "compatibility/cudawarping-upstream-classifications.json", "compatibility/cudawarping-upstream-map.txt", "compatibility/cudawarping-upstream-summary.json", "compatibility/cudawarping-implemented-families.json", "compatibility/upstream-map-catalog.json", "compatibility/upstream-map-catalog.schema.json", "scripts/New-UpstreamMapCatalog.ps1", "scripts/Test-UpstreamMapCatalog.ps1", "scripts/Initialize-UpstreamMapSourceEvidence.ps1", "docs/articles/upstream-map-toolchain.md", "docs/articles/cudawarping-upstream-parity-guide.md", "docs/toc.yml", "scripts/New-ReleaseCandidateFinalCloseout.ps1", "scripts/Test-ReleaseCandidateFinalCloseout.ps1" ] },
    { "id": "MAP-005-CUDABGSEGM", "category": "test-evidence", "surface": "tests", "owner": "cudabgsegm-contrib", "tfms": [ "net10.0" ], "profiles": [ "parser-backed-optional-module" ], "rollback": "remove the scoped CudaBgSegm declaration map and catalog registration while leaving the existing package API and native ABI unchanged", "evidence": [ "tools/XImgProcUpstreamMap/extract_ximgproc.py", "tools/CudaBgSegmUpstreamMap/CudaBgSegmUpstreamMap.csproj", "tools/CudaBgSegmUpstreamMap/Program.cs", "tools/CudaBgSegmUpstreamMap/extract_cudabgsegm.py", "scripts/Generate-ContribUpstreamMap.ps1", "scripts/Generate-CudaBgSegmUpstreamMap.ps1", "scripts/Test-CudaBgSegmUpstreamMap.ps1", "compatibility/cudabgsegm-upstream-raw.json", "compatibility/cudabgsegm-upstream-classifications.json", "compatibility/cudabgsegm-upstream-map.txt", "compatibility/cudabgsegm-upstream-summary.json", "compatibility/cudabgsegm-implemented-families.json", "compatibility/upstream-map-catalog.json", "compatibility/upstream-map-catalog.schema.json", "scripts/New-UpstreamMapCatalog.ps1", "scripts/Test-UpstreamMapCatalog.ps1", "scripts/Initialize-UpstreamMapSourceEvidence.ps1", "docs/articles/upstream-map-toolchain.md", "docs/articles/cudabgsegm-upstream-parity-guide.md", "docs/toc.yml", "scripts/New-ReleaseCandidateFinalCloseout.ps1", "scripts/Test-ReleaseCandidateFinalCloseout.ps1" ] },
    { "id": "MAP-005-CUDAFILTERS", "category": "test-evidence", "surface": "tests", "owner": "cudafilters-contrib", "tfms": [ "net10.0" ], "profiles": [ "parser-backed-optional-module" ], "rollback": "remove the scoped CudaFilters declaration map and catalog registration while leaving the existing package API and native ABI unchanged", "evidence": [ "tools/XImgProcUpstreamMap/extract_ximgproc.py", "tools/CudaFiltersUpstreamMap/CudaFiltersUpstreamMap.csproj", "tools/CudaFiltersUpstreamMap/Program.cs", "tools/CudaFiltersUpstreamMap/extract_cudafilters.py", "scripts/Generate-ContribUpstreamMap.ps1", "scripts/Generate-CudaFiltersUpstreamMap.ps1", "scripts/Test-CudaFiltersUpstreamMap.ps1", "compatibility/cudafilters-upstream-raw.json", "compatibility/cudafilters-upstream-classifications.json", "compatibility/cudafilters-upstream-map.txt", "compatibility/cudafilters-upstream-summary.json", "compatibility/cudafilters-implemented-families.json", "compatibility/upstream-map-catalog.json", "compatibility/upstream-map-catalog.schema.json", "scripts/New-UpstreamMapCatalog.ps1", "scripts/Test-UpstreamMapCatalog.ps1", "scripts/Initialize-UpstreamMapSourceEvidence.ps1", "docs/articles/upstream-map-toolchain.md", "docs/articles/cudafilters-upstream-parity-guide.md", "docs/toc.yml", "scripts/New-ReleaseCandidateFinalCloseout.ps1", "scripts/Test-ReleaseCandidateFinalCloseout.ps1" ] },